{
  "schema_version": 1,
  "id": "RUN-1792782665270-18104-0",
  "operation": "scan",
  "project": "mixed-safety-demo",
  "status": "incomplete",
  "complete": false,
  "completeness": {
    "total": 4,
    "analyzed": 4,
    "failed": 0,
    "excluded": 0,
    "unsupported": 0,
    "build_variants": [
      "VAR-59d26e56ac42efbf896ef09f1788fdd1129c016477634b0d86e449897570a99e",
      "VAR-14293ae00cdb67bf01d89dd6357f091a59dc38a7daa885428bd03167fd741f0e",
      "VAR-6c61e71e5d659d81fd75c68472b6a04b5d165baafee2350d9ddb485cb3c8c31b",
      "VAR-9ff35ff903434396903470597bbfe339f5cb6dcdd3927ada3c925391aaf00180"
    ]
  },
  "started_unix_ms": 1792782665272,
  "completed_unix_ms": 1792782665579,
  "inputs": {
    "build/compile_commands.json": "e9b5af8aea1013f7d447f5e315cc671737bdc19dd91a3133bab160a2db88dc22",
    "build/provenance.json": "85d35868d6188062027c5f3af7b6ce2bf8e5731b97e86c21f732bb23f38a59ea",
    "build/test": "68d361ec033697cf3eb7c8618cb75e18f7cd05ba2b80ed1ef460d59ed60c493e",
    "build/test.profdata": "238ce748fdb8206bdba393efdc79b38fafed96ad228187c3d92c20217d5f12c4",
    "build/test.profraw": "759e0756b256a0ffbb0aa401230292e849088806cad7186b24fba29b22c52f9c",
    "safety.yaml": "2c450d61ec520c5a7432b830d1ce10b02619440b11c0a2a49e62ffc6f6c12317",
    "src/controller.cpp": "aef7a38692b13aadcb07c235fc6614b6debff561a67154549f2b35a07e373bdd",
    "src/decision.c": "f5bc70baa14f155ece4dc543751f752fe69aa0047d747a22da9c60d5d1faf05f",
    "src/navigation.c": "95bffd3b239e7b3f952d396b357bfd30363a518242fffaf07b2662a5e79c1e48",
    "src/test.c": "290a1366331b3fbf24a04de09c4e1ed1d558cc0326bedd69f8cd306e49b01a99",
    "trace.yaml": "9398dfdd2fcc3f562bafb5de49deebf72382d500469a7cfa9219012075218b87"
  },
  "executions": [
    {
      "executable_sha256": "9dae295c1a4ffae4ee772e6205fcf22b26e1bfeeb5ee98f278b5139bda7ca22f",
      "restrictions": "network denied; filesystem isolation unavailable; trusted read-only analyzer invocation",
      "executable": "/usr/local/bin/git",
      "arguments": [
        "rev-parse",
        "HEAD"
      ],
      "cwd": "/workspace/safety/build/demo",
      "environment": {
        "HOME": "/workspace/safety/build/demo/.safety/runs/RUN-1792782665270-18104-0",
        "LANG": "C",
        "LC_ALL": "C",
        "TMPDIR": "/workspace/safety/build/demo/.safety/runs/RUN-1792782665270-18104-0"
      },
      "exit_code": 0,
      "failure": null,
      "duration_ms": 10,
      "stdout": "51cf37210e5ee7c698613c1de8a19de7ad2c36f3\n",
      "stderr": "",
      "timeout_seconds": 10
    },
    {
      "executable_sha256": "9dae295c1a4ffae4ee772e6205fcf22b26e1bfeeb5ee98f278b5139bda7ca22f",
      "restrictions": "network denied; filesystem isolation unavailable; trusted read-only analyzer invocation",
      "executable": "/usr/local/bin/git",
      "arguments": [
        "-c",
        "core.fsmonitor=false",
        "status",
        "--porcelain=v1",
        "--untracked-files=all"
      ],
      "cwd": "/workspace/safety/build/demo",
      "environment": {
        "HOME": "/workspace/safety/build/demo/.safety/runs/RUN-1792782665270-18104-0",
        "LANG": "C",
        "LC_ALL": "C",
        "TMPDIR": "/workspace/safety/build/demo/.safety/runs/RUN-1792782665270-18104-0"
      },
      "exit_code": 0,
      "failure": null,
      "duration_ms": 11,
      "stdout": " M src/adapters/esbmc.rs\n M src/coverage.rs\n M src/evidence.rs\n M src/trace.rs\n M tests/integration/coverage_fixture.py\n M tests/integration/mcp_client.py\n?? validation/e2e/cli-doctor.json\n?? validation/full-validation.log\n",
      "stderr": "",
      "timeout_seconds": 10
    },
    {
      "executable_sha256": "e4f4dd201e1e44451278c5302c687cffc7b1bf7c17102e7c58cfcdba88f5e69a",
      "restrictions": "network denied; filesystem isolation unavailable; trusted read-only analyzer invocation",
      "executable": "/workspace/scratch/llvm/usr/lib/llvm-19/bin/clang-tidy",
      "arguments": [
        "--version"
      ],
      "cwd": "/workspace/safety/build/demo",
      "environment": {
        "HOME": "/workspace/safety/build/demo/.safety/runs/RUN-1792782665270-18104-0",
        "LANG": "C",
        "LC_ALL": "C",
        "TMPDIR": "/workspace/safety/build/demo/.safety/runs/RUN-1792782665270-18104-0"
      },
      "exit_code": 0,
      "failure": null,
      "duration_ms": 32,
      "stdout": "Debian LLVM version 19.1.7\n  Optimized build.\n",
      "stderr": "",
      "timeout_seconds": 60
    },
    {
      "executable_sha256": "e4f4dd201e1e44451278c5302c687cffc7b1bf7c17102e7c58cfcdba88f5e69a",
      "restrictions": "network denied; filesystem isolation unavailable; trusted read-only analyzer invocation",
      "executable": "/workspace/scratch/llvm/usr/lib/llvm-19/bin/clang-tidy",
      "arguments": [
        "--load=/workspace/safety/build/clang/SafetyMisra.so",
        "-p=/workspace/safety/build/demo/.safety/runs/RUN-1792782665270-18104-0/unit-0",
        "--checks=-*,clang-analyzer-*,bugprone-sizeof-expression,bugprone-integer-division,bugprone-suspicious-semicolon,safety-prohibited-goto",
        "--config={InheritParentConfig: false, HeaderFilterRegex: '.*'}",
        "--export-fixes=/workspace/safety/build/demo/.safety/runs/RUN-1792782665270-18104-0/unit-0/diagnostics.yaml",
        "--quiet",
        "/workspace/safety/build/demo/src/navigation.c"
      ],
      "cwd": "/workspace/safety/build/demo",
      "environment": {
        "HOME": "/workspace/safety/build/demo/.safety/runs/RUN-1792782665270-18104-0",
        "LANG": "C",
        "LC_ALL": "C",
        "TMPDIR": "/workspace/safety/build/demo/.safety/runs/RUN-1792782665270-18104-0"
      },
      "exit_code": 0,
      "failure": null,
      "duration_ms": 40,
      "stdout": "src/navigation.c:6:16: warning: goto statement requires project policy review [safety-prohibited-goto]\n    6 |   if (enabled) goto done;\n      |                ^\n",
      "stderr": "1 warning generated.\n",
      "timeout_seconds": 60
    },
    {
      "executable_sha256": "e4f4dd201e1e44451278c5302c687cffc7b1bf7c17102e7c58cfcdba88f5e69a",
      "restrictions": "network denied; filesystem isolation unavailable; trusted read-only analyzer invocation",
      "executable": "/workspace/scratch/llvm/usr/lib/llvm-19/bin/clang-tidy",
      "arguments": [
        "--load=/workspace/safety/build/clang/SafetyMisra.so",
        "-p=/workspace/safety/build/demo/.safety/runs/RUN-1792782665270-18104-0/unit-1",
        "--checks=-*,clang-analyzer-*,bugprone-sizeof-expression,bugprone-integer-division,bugprone-suspicious-semicolon,safety-prohibited-goto",
        "--config={InheritParentConfig: false, HeaderFilterRegex: '.*'}",
        "--export-fixes=/workspace/safety/build/demo/.safety/runs/RUN-1792782665270-18104-0/unit-1/diagnostics.yaml",
        "--quiet",
        "/workspace/safety/build/demo/src/controller.cpp"
      ],
      "cwd": "/workspace/safety/build/demo",
      "environment": {
        "HOME": "/workspace/safety/build/demo/.safety/runs/RUN-1792782665270-18104-0",
        "LANG": "C",
        "LC_ALL": "C",
        "TMPDIR": "/workspace/safety/build/demo/.safety/runs/RUN-1792782665270-18104-0"
      },
      "exit_code": 0,
      "failure": null,
      "duration_ms": 41,
      "stdout": "",
      "stderr": "",
      "timeout_seconds": 60
    },
    {
      "executable_sha256": "e4f4dd201e1e44451278c5302c687cffc7b1bf7c17102e7c58cfcdba88f5e69a",
      "restrictions": "network denied; filesystem isolation unavailable; trusted read-only analyzer invocation",
      "executable": "/workspace/scratch/llvm/usr/lib/llvm-19/bin/clang-tidy",
      "arguments": [
        "--load=/workspace/safety/build/clang/SafetyMisra.so",
        "-p=/workspace/safety/build/demo/.safety/runs/RUN-1792782665270-18104-0/unit-2",
        "--checks=-*,clang-analyzer-*,bugprone-sizeof-expression,bugprone-integer-division,bugprone-suspicious-semicolon,safety-prohibited-goto",
        "--config={InheritParentConfig: false, HeaderFilterRegex: '.*'}",
        "--export-fixes=/workspace/safety/build/demo/.safety/runs/RUN-1792782665270-18104-0/unit-2/diagnostics.yaml",
        "--quiet",
        "/workspace/safety/build/demo/src/decision.c"
      ],
      "cwd": "/workspace/safety/build/demo",
      "environment": {
        "HOME": "/workspace/safety/build/demo/.safety/runs/RUN-1792782665270-18104-0",
        "LANG": "C",
        "LC_ALL": "C",
        "TMPDIR": "/workspace/safety/build/demo/.safety/runs/RUN-1792782665270-18104-0"
      },
      "exit_code": 0,
      "failure": null,
      "duration_ms": 40,
      "stdout": "",
      "stderr": "",
      "timeout_seconds": 60
    },
    {
      "executable_sha256": "e4f4dd201e1e44451278c5302c687cffc7b1bf7c17102e7c58cfcdba88f5e69a",
      "restrictions": "network denied; filesystem isolation unavailable; trusted read-only analyzer invocation",
      "executable": "/workspace/scratch/llvm/usr/lib/llvm-19/bin/clang-tidy",
      "arguments": [
        "--load=/workspace/safety/build/clang/SafetyMisra.so",
        "-p=/workspace/safety/build/demo/.safety/runs/RUN-1792782665270-18104-0/unit-3",
        "--checks=-*,clang-analyzer-*,bugprone-sizeof-expression,bugprone-integer-division,bugprone-suspicious-semicolon,safety-prohibited-goto",
        "--config={InheritParentConfig: false, HeaderFilterRegex: '.*'}",
        "--export-fixes=/workspace/safety/build/demo/.safety/runs/RUN-1792782665270-18104-0/unit-3/diagnostics.yaml",
        "--quiet",
        "/workspace/safety/build/demo/src/test.c"
      ],
      "cwd": "/workspace/safety/build/demo",
      "environment": {
        "HOME": "/workspace/safety/build/demo/.safety/runs/RUN-1792782665270-18104-0",
        "LANG": "C",
        "LC_ALL": "C",
        "TMPDIR": "/workspace/safety/build/demo/.safety/runs/RUN-1792782665270-18104-0"
      },
      "exit_code": 0,
      "failure": null,
      "duration_ms": 41,
      "stdout": "",
      "stderr": "",
      "timeout_seconds": 60
    }
  ],
  "findings": [
    {